{
  "matrixId": "logsense-relation-admission-v0.1",
  "version": "0.1.1-phase55",
  "referenceVocabularySha": "8d261ec9ac46ee4be85490a113b15c667d0a33ee",
  "relationCount": 113,
  "entries": [
    {
      "relationType": "REALIZED_BY",
      "profileId": "STRUCTURAL_DECLARED",
      "family": "STRUCTURAL",
      "claimClass": "STRUCTURAL_BINDING",
      "semanticPurpose": "Realized By",
      "admissionCeiling": "ESTABLISHED",
      "proposalEvidenceBases": [
        "SCHEMA_MAPPING",
        "TOPOLOGY_DECLARATION"
      ],
      "establishmentEvidenceBases": [
        "SOURCE_NATIVE_RELATION",
        "ADAPTER_DECLARED_RELATION",
        "STATIC_EXACT_RELATION"
      ],
      "requiredSourceIdentityState": "PARTIAL",
      "requiredTargetIdentityState": "PARTIAL",
      "requiredConditions": [
        "EVIDENCE_REFS_PRESENT",
        "DIRECTION_PRESERVED",
        "SCENARIO_SCOPE_COMPATIBLE"
      ],
      "forbiddenAdmissionBases": [
        "DISPLAY_NAME_ONLY",
        "TIMESTAMP_PROXIMITY_ONLY",
        "FREE_TEXT_SIMILARITY_ONLY",
        "AI_PROPOSAL_ONLY"
      ],
      "hardNegatives": [
        "DISPLAY_NAME_MATCH != RELATION",
        "TIMESTAMP_PROXIMITY != RELATION",
        "CORRELATION_FACT != CAUSAL_RELATION"
      ],
      "contradictionMinimumEvidenceRefs": 2,
      "requiresIndependentLineageForEstablishment": false,
      "qualifiesReachability": false,
      "qualifiesConsequencePropagation": true,
      "runtimeInterpretation": "NO_RUNTIME_EXECUTION_MEANING",
      "causeRuleConsumerRefs": [],
      "gapTypes": [
        "RELATION_UNESTABLISHED"
      ],
      "haiecReferences": [
        "lib/evidence/evidence-contract.ts",
        "lib/evidence/semantic-relation.ts"
      ],
      "notes": []
    },
    {
      "relationType": "DEPENDS_ON",
      "profileId": "STRUCTURAL_DECLARED",
      "family": "STRUCTURAL",
      "claimClass": "STRUCTURAL_BINDING",
      "semanticPurpose": "Depends On",
      "admissionCeiling": "ESTABLISHED",
      "proposalEvidenceBases": [
        "SCHEMA_MAPPING",
        "TOPOLOGY_DECLARATION"
      ],
      "establishmentEvidenceBases": [
        "SOURCE_NATIVE_RELATION",
        "ADAPTER_DECLARED_RELATION",
        "STATIC_EXACT_RELATION"
      ],
      "requiredSourceIdentityState": "PARTIAL",
      "requiredTargetIdentityState": "PARTIAL",
      "requiredConditions": [
        "EVIDENCE_REFS_PRESENT",
        "DIRECTION_PRESERVED",
        "SCENARIO_SCOPE_COMPATIBLE"
      ],
      "forbiddenAdmissionBases": [
        "DISPLAY_NAME_ONLY",
        "TIMESTAMP_PROXIMITY_ONLY",
        "FREE_TEXT_SIMILARITY_ONLY",
        "AI_PROPOSAL_ONLY"
      ],
      "hardNegatives": [
        "DISPLAY_NAME_MATCH != RELATION",
        "TIMESTAMP_PROXIMITY != RELATION",
        "CORRELATION_FACT != CAUSAL_RELATION"
      ],
      "contradictionMinimumEvidenceRefs": 2,
      "requiresIndependentLineageForEstablishment": false,
      "qualifiesReachability": false,
      "qualifiesConsequencePropagation": true,
      "runtimeInterpretation": "NO_RUNTIME_EXECUTION_MEANING",
      "causeRuleConsumerRefs": [
        "CR-INFRA-001"
      ],
      "gapTypes": [
        "RELATION_UNESTABLISHED"
      ],
      "haiecReferences": [
        "lib/evidence/evidence-contract.ts",
        "lib/evidence/semantic-relation.ts"
      ],
      "notes": []
    },
    {
      "relationType": "HOSTED_ON",
      "profileId": "STRUCTURAL_DECLARED",
      "family": "STRUCTURAL",
      "claimClass": "STRUCTURAL_BINDING",
      "semanticPurpose": "Hosted On",
      "admissionCeiling": "ESTABLISHED",
      "proposalEvidenceBases": [
        "SCHEMA_MAPPING",
        "TOPOLOGY_DECLARATION"
      ],
      "establishmentEvidenceBases": [
        "SOURCE_NATIVE_RELATION",
        "ADAPTER_DECLARED_RELATION",
        "STATIC_EXACT_RELATION"
      ],
      "requiredSourceIdentityState": "PARTIAL",
      "requiredTargetIdentityState": "PARTIAL",
      "requiredConditions": [
        "EVIDENCE_REFS_PRESENT",
        "DIRECTION_PRESERVED",
        "SCENARIO_SCOPE_COMPATIBLE"
      ],
      "forbiddenAdmissionBases": [
        "DISPLAY_NAME_ONLY",
        "TIMESTAMP_PROXIMITY_ONLY",
        "FREE_TEXT_SIMILARITY_ONLY",
        "AI_PROPOSAL_ONLY"
      ],
      "hardNegatives": [
        "DISPLAY_NAME_MATCH != RELATION",
        "TIMESTAMP_PROXIMITY != RELATION",
        "CORRELATION_FACT != CAUSAL_RELATION"
      ],
      "contradictionMinimumEvidenceRefs": 2,
      "requiresIndependentLineageForEstablishment": false,
      "qualifiesReachability": false,
      "qualifiesConsequencePropagation": true,
      "runtimeInterpretation": "NO_RUNTIME_EXECUTION_MEANING",
      "causeRuleConsumerRefs": [],
      "gapTypes": [
        "RELATION_UNESTABLISHED"
      ],
      "haiecReferences": [
        "lib/evidence/evidence-contract.ts",
        "lib/evidence/semantic-relation.ts"
      ],
      "notes": []
    },
    {
      "relationType": "CONNECTED_TO",
      "profileId": "STRUCTURAL_DECLARED",
      "family": "STRUCTURAL",
      "claimClass": "STRUCTURAL_BINDING",
      "semanticPurpose": "Connected To",
      "admissionCeiling": "ESTABLISHED",
      "proposalEvidenceBases": [
        "SCHEMA_MAPPING",
        "TOPOLOGY_DECLARATION"
      ],
      "establishmentEvidenceBases": [
        "SOURCE_NATIVE_RELATION",
        "ADAPTER_DECLARED_RELATION",
        "STATIC_EXACT_RELATION"
      ],
      "requiredSourceIdentityState": "PARTIAL",
      "requiredTargetIdentityState": "PARTIAL",
      "requiredConditions": [
        "EVIDENCE_REFS_PRESENT",
        "DIRECTION_PRESERVED",
        "SCENARIO_SCOPE_COMPATIBLE"
      ],
      "forbiddenAdmissionBases": [
        "DISPLAY_NAME_ONLY",
        "TIMESTAMP_PROXIMITY_ONLY",
        "FREE_TEXT_SIMILARITY_ONLY",
        "AI_PROPOSAL_ONLY"
      ],
      "hardNegatives": [
        "DISPLAY_NAME_MATCH != RELATION",
        "TIMESTAMP_PROXIMITY != RELATION",
        "CORRELATION_FACT != CAUSAL_RELATION",
        "TOPOLOGY_ADJACENCY != IMPACT_DEPENDENCY"
      ],
      "contradictionMinimumEvidenceRefs": 2,
      "requiresIndependentLineageForEstablishment": false,
      "qualifiesReachability": false,
      "qualifiesConsequencePropagation": false,
      "runtimeInterpretation": "NO_RUNTIME_EXECUTION_MEANING",
      "causeRuleConsumerRefs": [
        "CR-INFRA-001"
      ],
      "gapTypes": [
        "RELATION_UNESTABLISHED"
      ],
      "haiecReferences": [
        "lib/evidence/evidence-contract.ts",
        "lib/evidence/semantic-relation.ts"
      ],
      "notes": [
        "Topology adjacency only; never reachability or impact dependency by itself."
      ]
    },
    {
      "relationType": "PART_OF",
      "profileId": "STRUCTURAL_DECLARED",
      "family": "STRUCTURAL",
      "claimClass": "STRUCTURAL_BINDING",
      "semanticPurpose": "Part Of",
      "admissionCeiling": "ESTABLISHED",
      "proposalEvidenceBases": [
        "SCHEMA_MAPPING",
        "TOPOLOGY_DECLARATION"
      ],
      "establishmentEvidenceBases": [
        "SOURCE_NATIVE_RELATION",
        "ADAPTER_DECLARED_RELATION",
        "STATIC_EXACT_RELATION"
      ],
      "requiredSourceIdentityState": "PARTIAL",
      "requiredTargetIdentityState": "PARTIAL",
      "requiredConditions": [
        "EVIDENCE_REFS_PRESENT",
        "DIRECTION_PRESERVED",
        "SCENARIO_SCOPE_COMPATIBLE"
      ],
      "forbiddenAdmissionBases": [
        "DISPLAY_NAME_ONLY",
        "TIMESTAMP_PROXIMITY_ONLY",
        "FREE_TEXT_SIMILARITY_ONLY",
        "AI_PROPOSAL_ONLY"
      ],
      "hardNegatives": [
        "DISPLAY_NAME_MATCH != RELATION",
        "TIMESTAMP_PROXIMITY != RELATION",
        "CORRELATION_FACT != CAUSAL_RELATION"
      ],
      "contradictionMinimumEvidenceRefs": 2,
      "requiresIndependentLineageForEstablishment": false,
      "qualifiesReachability": false,
      "qualifiesConsequencePropagation": true,
      "runtimeInterpretation": "NO_RUNTIME_EXECUTION_MEANING",
      "causeRuleConsumerRefs": [],
      "gapTypes": [
        "RELATION_UNESTABLISHED"
      ],
      "haiecReferences": [
        "lib/evidence/evidence-contract.ts",
        "lib/evidence/semantic-relation.ts"
      ],
      "notes": []
    },
    {
      "relationType": "SERVES",
      "profileId": "STRUCTURAL_DECLARED",
      "family": "STRUCTURAL",
      "claimClass": "STRUCTURAL_BINDING",
      "semanticPurpose": "Serves",
      "admissionCeiling": "ESTABLISHED",
      "proposalEvidenceBases": [
        "SCHEMA_MAPPING",
        "TOPOLOGY_DECLARATION"
      ],
      "establishmentEvidenceBases": [
        "SOURCE_NATIVE_RELATION",
        "ADAPTER_DECLARED_RELATION",
        "STATIC_EXACT_RELATION"
      ],
      "requiredSourceIdentityState": "PARTIAL",
      "requiredTargetIdentityState": "PARTIAL",
      "requiredConditions": [
        "EVIDENCE_REFS_PRESENT",
        "DIRECTION_PRESERVED",
        "SCENARIO_SCOPE_COMPATIBLE"
      ],
      "forbiddenAdmissionBases": [
        "DISPLAY_NAME_ONLY",
        "TIMESTAMP_PROXIMITY_ONLY",
        "FREE_TEXT_SIMILARITY_ONLY",
        "AI_PROPOSAL_ONLY"
      ],
      "hardNegatives": [
        "DISPLAY_NAME_MATCH != RELATION",
        "TIMESTAMP_PROXIMITY != RELATION",
        "CORRELATION_FACT != CAUSAL_RELATION"
      ],
      "contradictionMinimumEvidenceRefs": 2,
      "requiresIndependentLineageForEstablishment": false,
      "qualifiesReachability": false,
      "qualifiesConsequencePropagation": true,
      "runtimeInterpretation": "NO_RUNTIME_EXECUTION_MEANING",
      "causeRuleConsumerRefs": [],
      "gapTypes": [
        "RELATION_UNESTABLISHED"
      ],
      "haiecReferences": [
        "lib/evidence/evidence-contract.ts",
        "lib/evidence/semantic-relation.ts"
      ],
      "notes": []
    },
    {
      "relationType": "IMPLEMENTS",
      "profileId": "STRUCTURAL_DECLARED",
      "family": "STRUCTURAL",
      "claimClass": "STRUCTURAL_BINDING",
      "semanticPurpose": "Implements",
      "admissionCeiling": "ESTABLISHED",
      "proposalEvidenceBases": [